{
  "$schema": "http://json-schema.org/draft-07/schema#",
  "type": "object",
  "required": ["hosts", "triggers", "command"],
  "properties": {
    "hosts": {
      "type": "array",
      "description": "List of server hostnames this configuration applies to",
      "items": {
        "type": "string",
        "pattern": "^[a-zA-Z0-9][a-zA-Z0-9-._]*\\.[a-zA-Z]{2,}$",
        "minLength": 4
      },
      "minItems": 1,
      "uniqueItems": true
    },
    "triggers": {
      "type": "array",
      "items": {
        "type": "object",
        "required": ["pattern"],
        "properties": {
          "pattern": {
            "type": "string",
            "minLength": 1,
            "description": "The text pattern to match against"
          },
          "matchType": {
            "type": "string",
            "enum": ["exact", "prefix", "contains", "suffix"],
            "default": "prefix",
            "description": "How the pattern should be matched against the text"
          },
          "caseSensitive": {
            "type": "boolean",
            "default": true,
            "description": "Whether the pattern matching should be case-sensitive"
          }
        }
      },
      "minItems": 1,
      "uniqueItems": true
    },
    "command": {
      "type": "string",
      "pattern": "^/.*\\{message\\}.*$",
      "minLength": 2,
      "description": "Command with {message} parameter placeholder"
    },
    "validation": {
      "type": "object",
      "properties": {
        "startsWith": {
          "type": "string",
          "description": "Required prefix for valid messages"
        },
        "endsWith": {
          "type": "string",
          "description": "Required suffix for valid messages"
        },
        "excludePatterns": {
          "type": "array",
          "items": {
            "type": "string",
            "minLength": 1
          },
          "uniqueItems": true,
          "default": [],
          "description": "Patterns that should not appear in valid messages"
        }
      }
    }
  }
}
