{
  "hosts": ["hypixel.net"],
  "triggers": [
    {
      "pattern": "1st Killer - ",
      "matchType": "contains"
    },
    {
      "pattern": "1st Place - ",
      "matchType": "contains"
    },
    {
      "pattern": " - Damage Dealt - ",
      "matchType": "contains"
    },
    {
      "pattern": "Winning Team - ",
      "matchType": "contains"
    },
    {
      "pattern": "1st - ",
      "matchType": "contains"
    },
    {
      "pattern": "Winners: ",
      "matchType": "contains"
    },
    {
      "pattern": "Winner: ",
      "matchType": "contains"
    },
    {
      "pattern": "Winning Team: ",
      "matchType": "contains"
    },
    {
      "pattern": " won the game!",
      "matchType": "contains"
    },
    {
      "pattern": "Top Seeker: ",
      "matchType": "contains"
    },
    {
      "pattern": "1st Place: ",
      "matchType": "contains"
    },
    {
      "pattern": "Last team standing!",
      "matchType": "contains"
    },
    {
      "pattern": "Winner #1 (",
      "matchType": "contains"
    },
    {
      "pattern": "Top Survivors",
      "matchType": "contains"
    },
    {
      "pattern": "Winners - ",
      "matchType": "contains"
    },
    {
      "pattern": " - Melee Accuracy - ",
      "matchType": "contains"
    }
  ],
  "command": "/ac {message}",
  "validation": {
    "startsWith": " "
  }
}
